{
  "alternatives": [],
  "analyses": [
    {
      "alternatives": [],
      "comparison": null,
      "config_hash": "e131f1043af7e5e3fefcbea7ffb0b5b61979fdd689364053c0aaa32e4b74813e",
      "forecast_origin_source_s": null,
      "forecasts": [],
      "input_quality": "missing",
      "input_session_id": "443c9a23-62b5-4f6e-afbc-aed2cd4b9066",
      "metrics_version": "flow-metrics-v1",
      "model_version": "aggregate-predictor-v1",
      "outcome": "cannot_evaluate",
      "recommendation": null,
      "recorded_at_utc": "2026-10-05T04:21:53.572796Z",
      "run_id": "054b0bff-94f4-40a3-8f3d-d635564991f1",
      "sequence": 929,
      "simulation_time_s": 4,
      "snapshot_sequence": 5
    },
    {
      "alternatives": [],
      "comparison": null,
      "config_hash": "e131f1043af7e5e3fefcbea7ffb0b5b61979fdd689364053c0aaa32e4b74813e",
      "forecast_origin_source_s": 5,
      "forecasts": [
        {
          "arrivals_veh": 0,
          "horizon_s": 30,
          "horizon_status": "available",
          "input_age_s": 39756.171604,
          "input_quality": "cached_valid",
          "method": "persistence",
          "movement_id": "C2-C1-C3",
          "occupancy_ratio": 0,
          "origin_source_s": 5,
          "queue_veh": 0,
          "uncertainty_status": "unavailable"
        },
        {
          "arrivals_veh": 0,
          "horizon_s": 30,
          "horizon_status": "available",
          "input_age_s": 39756.171604,
          "input_quality": "cached_valid",
          "method": "persistence",
          "movement_id": "C2-C1-C4",
          "occupancy_ratio": 0,
          "origin_source_s": 5,
          "queue_veh": 0,
          "uncertainty_status": "unavailable"
        },
        {
          "arrivals_veh": 0,
          "horizon_s": 30,
          "horizon_status": "available",
          "input_age_s": 39756.171604,
          "input_quality": "cached_valid",
          "method": "persistence",
          "movement_id": "C2-C1-C5",
          "occupancy_ratio": 0,
          "origin_source_s": 5,
          "queue_veh": 0,
          "uncertainty_status": "unavailable"
        },
        {
          "arrivals_veh": 0,
          "horizon_s": 30,
          "horizon_status": "available",
          "input_age_s": 39756.171604,
          "input_quality": "cached_valid",
          "method": "persistence",
          "movement_id": "C1-C3-C6",
          "occupancy_ratio": 0,
          "origin_source_s": 5,
          "queue_veh": 0,
          "uncertainty_status": "unavailable"
        },
        {
          "arrivals_veh": 0,
          "horizon_s": 30,
          "horizon_status": "available",
          "input_age_s": 39756.171604,
          "input_quality": "cached_valid",
          "method": "persistence",
          "movement_id": "C3-C1-C2",
          "occupancy_ratio": 0,
          "origin_source_s": 5,
          "queue_veh": 0,
          "uncertainty_status": "unavailable"
        },
        {
          "arrivals_veh": 0,
          "horizon_s": 30,
          "horizon_status": "available",
          "input_age_s": 39756.171604,
          "input_quality": "cached_valid",
          "method": "persistence",
          "movement_id": "C3-C1-C4",
          "occupancy_ratio": 0,
          "origin_source_s": 5,
          "queue_veh": 0,
          "uncertainty_status": "unavailable"
        },
        {
          "arrivals_veh": 0,
          "horizon_s": 30,
          "horizon_status": "available",
          "input_age_s": 39756.171604,
          "input_quality": "cached_valid",
          "method": "persistence",
          "movement_id": "C3-C1-C5",
          "occupancy_ratio": 0,
          "origin_source_s": 5,
          "queue_veh": 0,
          "uncertainty_status": "unavailable"
        },
        {
          "arrivals_veh": 6.000000000000003,
          "horizon_s": 30,
          "horizon_status": "available",
          "input_age_s": 39756.171604,
          "input_quality": "cached_valid",
          "method": "persistence",
          "movement_id": "C4-C1-C2",
          "occupancy_ratio": 0,
          "origin_source_s": 5,
          "queue_veh": 0,
          "uncertainty_status": "unavailable"
        },
        {
          "arrivals_veh": 6.000000000000003,
          "horizon_s": 30,
          "horizon_status": "available",
          "input_age_s": 39756.171604,
          "input_quality": "cached_valid",
          "method": "persistence",
          "movement_id": "C4-C1-C3",
          "occupancy_ratio": 0,
          "origin_source_s": 5,
          "queue_veh": 0,
          "uncertainty_status": "unavailable"
        },
        {
          "arrivals_veh": 6.000000000000003,
          "horizon_s": 30,
          "horizon_status": "available",
          "input_age_s": 39756.171604,
          "input_quality": "cached_valid",
          "method": "persistence",
          "movement_id": "C4-C1-C5",
          "occupancy_ratio": 0,
          "origin_source_s": 5,
          "queue_veh": 0,
          "uncertainty_status": "unavailable"
        },
        {
          "arrivals_veh": 0,
          "horizon_s": 30,
          "horizon_status": "available",
          "input_age_s": 39756.171604,
          "input_quality": "cached_valid",
          "method": "persistence",
          "movement_id": "C5-C1-C2",
          "occupancy_ratio": 0,
          "origin_source_s": 5,
          "queue_veh": 0,
          "uncertainty_status": "unavailable"
        },
        {
          "arrivals_veh": 0,
          "horizon_s": 30,
          "horizon_status": "available",
          "input_age_s": 39756.171604,
          "input_quality": "cached_valid",
          "method": "persistence",
          "movement_id": "C5-C1-C3",
          "occupancy_ratio": 0,
          "origin_source_s": 5,
          "queue_veh": 0,
          "uncertainty_status": "unavailable"
        },
        {
          "arrivals_veh": 0,
          "horizon_s": 30,
          "horizon_status": "available",
          "input_age_s": 39756.171604,
          "input_quality": "cached_valid",
          "method": "persistence",
          "movement_id": "C5-C1-C4",
          "occupancy_ratio": 0,
          "origin_source_s": 5,
          "queue_veh": 0,
          "uncertainty_status": "unavailable"
        },
        {
          "arrivals_veh": 0,
          "horizon_s": 30,
          "horizon_status": "available",
          "input_age_s": 39756.171604,
          "input_quality": "cached_valid",
          "method": "persistence",
          "movement_id": "C6-C3-C1",
          "occupancy_ratio": 0,
          "origin_source_s": 5,
          "queue_veh": 0,
          "uncertainty_status": "unavailable"
        },
        {
          "arrivals_veh": 0,
          "horizon_s": 60,
          "horizon_status": "available",
          "input_age_s": 39756.171604,
          "input_quality": "cached_valid",
          "method": "persistence",
          "movement_id": "C2-C1-C3",
          "occupancy_ratio": 0,
          "origin_source_s": 5,
          "queue_veh": 0,
          "uncertainty_status": "unavailable"
        },
        {
          "arrivals_veh": 0,
          "horizon_s": 60,
          "horizon_status": "available",
          "input_age_s": 39756.171604,
          "input_quality": "cached_valid",
          "method": "persistence",
          "movement_id": "C2-C1-C4",
          "occupancy_ratio": 0,
          "origin_source_s": 5,
          "queue_veh": 0,
          "uncertainty_status": "unavailable"
        },
        {
          "arrivals_veh": 0,
          "horizon_s": 60,
          "horizon_status": "available",
          "input_age_s": 39756.171604,
          "input_quality": "cached_valid",
          "method": "persistence",
          "movement_id": "C2-C1-C5",
          "occupancy_ratio": 0,
          "origin_source_s": 5,
          "queue_veh": 0,
          "uncertainty_status": "unavailable"
        },
        {
          "arrivals_veh": 0,
          "horizon_s": 60,
          "horizon_status": "available",
          "input_age_s": 39756.171604,
          "input_quality": "cached_valid",
          "method": "persistence",
          "movement_id": "C1-C3-C6",
          "occupancy_ratio": 0,
          "origin_source_s": 5,
          "queue_veh": 0,
          "uncertainty_status": "unavailable"
        },
        {
          "arrivals_veh": 0,
          "horizon_s": 60,
          "horizon_status": "available",
          "input_age_s": 39756.171604,
          "input_quality": "cached_valid",
          "method": "persistence",
          "movement_id": "C3-C1-C2",
          "occupancy_ratio": 0,
          "origin_source_s": 5,
          "queue_veh": 0,
          "uncertainty_status": "unavailable"
        },
        {
          "arrivals_veh": 0,
          "horizon_s": 60,
          "horizon_status": "available",
          "input_age_s": 39756.171604,
          "input_quality": "cached_valid",
          "method": "persistence",
          "movement_id": "C3-C1-C4",
          "occupancy_ratio": 0,
          "origin_source_s": 5,
          "queue_veh": 0,
          "uncertainty_status": "unavailable"
        },
        {
          "arrivals_veh": 0,
          "horizon_s": 60,
          "horizon_status": "available",
          "input_age_s": 39756.171604,
          "input_quality": "cached_valid",
          "method": "persistence",
          "movement_id": "C3-C1-C5",
          "occupancy_ratio": 0,
          "origin_source_s": 5,
          "queue_veh": 0,
          "uncertainty_status": "unavailable"
        },
        {
          "arrivals_veh": 11.99999999999999,
          "horizon_s": 60,
          "horizon_status": "available",
          "input_age_s": 39756.171604,
          "input_quality": "cached_valid",
          "method": "persistence",
          "movement_id": "C4-C1-C2",
          "occupancy_ratio": 0.2222222222222222,
          "origin_source_s": 5,
          "queue_veh": 7.111111111111111,
          "uncertainty_status": "unavailable"
        },
        {